,店铺名字,类别,id,地址,日销售,经度,纬度
387,foodifoodi甘草水果(龙口东店),奶茶果汁,E2216972903019287591,广州天河区龙口东路370号,23,113.340762,23.144107
388,奇乐美蛋糕店,蛋糕,E6667306202580505223,广州市荔湾区芳村大道西378号五金城C座4号,1,113.207101,23.116774
389,花h橙鲜榨果汁店,奶茶果汁,E414103696652028446,怡新路229号09商铺,1,113.328597,23.175708
390,超润甜品,甜品,E2543933946141019854,石牌村豪居大街8号102铺,0,113.341635,23.128091
391,茶语欧麦,奶茶果汁,E9217696818915005017,广州大道1419号佳润广场首层、二层及三层商铺内铺,1,113.320085,23.18208
392,绯茶（同胜街店）,奶茶果汁,E16959389085813579081,广州市白云区同和同胜街丽庭居A栋21号铺,1,113.326916,23.197212
393,初遇の茶丨奶茶小吃(岗顶店),奶茶果汁,E1978268754436927690,石牌朝阳大街36号东铺,670,113.34219,23.131273
394,FirstDateCoffee,奶茶果汁,E17224760051678682003,广州市天河区天寿路沾益直街4号大院内自编6号,6,113.334083,23.146662
395,Cake遇见蛋糕(天河店),蛋糕,E13928004277245909039,广棠西横路5号202-5房,1,113.385564,23.137992
396,岛滋・古法黑糖,奶茶果汁,E9475473639706357704,广州大道北1968号合一国际203铺之四,108,113.328472,23.191836
397,优乐滋手工烘培,蛋糕,E10337069013994004643,员村二横路10号之三,1,113.364912,23.115789
398,啡尝道休闲咖啡厅,h饭,E9975007379110488243,沙太路麒麟中街24号首层局部,5,113.336301,23.184982
399,HiTea茶室,奶茶果汁,E4961067348817985036,茶山路261号之一231铺,0,113.35393,23.151179
400,丝娃娃慢时光小屋,奶茶果汁,E3751941995594848419,迎龙路167号1栋215铺,0,113.364525,23.197662
401,骰娇现炖燕窝花胶滋补炖品（番禺店）,粤菜,E17994363294010600130,钟村街钟三村钟韵路8号五羊茶叶城A10,1,113.324732,22.970382
402,御茶(龙口东店),奶茶果汁,E9885929587632049349,龙口东路5号龙晖大厦,6,113.341211,23.136429
403,黑蝴蝶蛋糕(三元里店),蛋糕,E7195057562463557588,抗英大街28号之一首层,2,113.261751,23.157953
