店铺名字,类别,月销售,经度,纬度,地址
茶自然(兴盛店),奶茶果汁,779,113.791182,22.760778,东莞市长安镇新民社区兴盛路利民巷3号A001号铺
royaltea皇茶(步涌店),奶茶果汁,573,113.816594,22.753639,深圳市宝安区沙井街道步涌市场威雅百货一楼
鲜果茶,奶茶果汁,356,113.78694,22.76825,东莞市长安镇建安路50号101室
嘿茶,奶茶果汁,97,113.78555,22.746381,沙井街道锦绣小区E2栋102
royaltea皇茶(新民店),奶茶果汁,44,113.791369,22.762275,东莞市长安镇新民社区兴盛路四巷九号之三
茶萃吧奶茶小吃(沙井店),奶茶果汁,221,113.802383,22.754873,沙井街道共和社区家和路1号共和市场110
茶小肆(步涌店),奶茶果汁,320,113.81136,22.758226,沙井街道新和大道90号新万众百货一楼
85极致咖啡(乌沙大润发店),奶茶果汁,164,113.789485,22.780085,长安镇乌沙大润发长实大厦南区104商铺
真悦royaltea皇茶(步涌店),奶茶果汁,49,113.816615,22.754265,深圳市宝安区沙井街道步涌社区环镇北路422号110
520茶屋,奶茶果汁,9,113.800419,22.758571,沙井街道共和社区福和路西十四巷15号181
好时光小食店,奶茶果汁,24,113.810385,22.751912,沙井街道步涌社区步涌二路榕树3号102
茶萃吧(兴一路店),奶茶果汁,45,113.785559,22.765791,东莞市长安镇乌沙社区陈屋村兴一路378号一楼102号铺
徐其修凉茶,奶茶果汁,91,113.806,22.736297,沙井街道沙井大街190号
青沫茶颜,奶茶果汁,41,113.810915,22.75703,深圳市沙井街道步涌社区围后底五巷12号101
魅力茶吧爽洋洋,奶茶果汁,28,113.813308,22.755604,步涌上埔路132号
星探鲜果原茶,奶茶果汁,37,113.82763,22.752592,沙井街道衙边社区后亭地铁站C出口同方创意园A栋113
茶萃吧(碧头店),奶茶果汁,28,113.810721,22.780701,松岗街道碧头社区许屋二巷1号102
泰芒奶茶,奶茶果汁,13,113.813512,22.781747,碧头社区碧头街15号101-1
魅力茶吧爽洋洋,奶茶果汁,41,113.810738,22.758498,沙井街道步涌社区新和大道92号
royaltea are皇茶(松岗店),奶茶果汁,19,113.821015,22.770127,深圳市宝安区松岗街道朗下社区松岗街道沙江路中海西岸华府11栋商业115
GS饮品店,奶茶果汁,3,113.798333,22.755126,沙井街道共和社区家和路21号一层2号
张山疯奶茶,奶茶果汁,5,113.804134,22.760955,深圳市宝安区沙井街道共和社区新和大道2-1号
茶萃吧,奶茶果汁,4,113.811111,22.758166,沙井街道步涌社区新和大道90号20号铺
城市茶语,奶茶果汁,1,113.816591,22.739932,深圳市宝安区沙井街道衙边社区衙边大塘小区23号103
地铁站港饮(松岗店),奶茶果汁,142,113.820823,22.759689,沙井街道后亭社区大园工业区1栋北亭路53号
1314奶茶店一杯会说话的茶(中亚店),奶茶果汁,42,113.820804,22.742515,深圳市宝安区沙井街道n岗社区岗头路29号商业楼GB10B13
奇味有道奶茶,奶茶果汁,8,113.820289,22.753914,沙井街道后亭新村东13巷1号2楼
柠檬小黄人,奶茶果汁,1,113.812921,22.739974,深圳市宝安区沙井街道环镇路衙边商住楼10栋104
5叶茶(后亭店),奶茶果汁,29,113.82802,22.756356,深圳市宝安区沙井街道后亭社区第二工业区58号福新大厦
乐茶香餐饮吧,奶茶果汁,1,113.80939,22.752646,沙井街道步涌二路西边冲三巷九号
喜果茶（沙井店）,奶茶果汁,1,113.805315,22.7607,深圳市宝安区沙井街道步涌社区新和大道118-19
茶一郎,奶茶果汁,2,113.814112,22.754272,深圳市宝安区沙井街道步涌社区村前大道38号103
Wowtea饮品学院,奶茶果汁,1,113.81906,22.74791,沙井蚝一岗头工业区鹏城汇合物流园B栋109号
茶萃吧,奶茶果汁,1,113.82243,22.75604,深圳市宝安区沙井街道后亭社区新村东四巷11号中亭南路57号
茶翠吧(后亭店),奶茶果汁,0,113.821025,22.757532,沙井街道后亭社区宝亭锦园1栋B座1-33
悦茶廊(花果山店),奶茶果汁,0,113.835918,22.771201,松岗街道花果山社区松岗工业区晖泓大厦（松瑞路107号）102
茶萃吧(长安锦华店),奶茶果汁,255,113.799561,22.80424,广东省东莞市长安镇锦华街28号102室
序茶(莲峰店),奶茶果汁,145,113.809209,22.80898,东莞市长安镇长安莲峰路107号127室
三个先森的韩国炸鸡（长安店）,奶茶果汁,446,113.809113,22.805812,长安镇常荣南街26号101室
快乐番薯(长安万科店),奶茶果汁,337,113.800618,22.800246,广东省东莞市长安镇万科广场负一楼百佳超市收银出口处快乐番薯
心茶,奶茶果汁,129,113.7994208,22.80623128,广东省东莞市长安镇锦华街58号103室
皇萃贡茶,奶茶果汁,551,113.799517,22.80092,东莞市长安镇长青南路万科中心5栋108号
茶萃吧(万科广场店),奶茶果汁,397,113.800257,22.801329,东莞市长安镇长安长青南路1号5栋120室
御茗贡茶,奶茶果汁,1511,113.81599,22.808275,长安镇霄边和兴九巷6号101室
爽洋洋奶茶汉堡（陈屋汇店）,奶茶果汁,26,113.790213,22.788893,东莞市长安镇乌沙社区陈屋江河街6号一楼102
JulyTea柒h茶(万科店),奶茶果汁,98,113.806418,22.807478,长安镇咸西社区别墅街24号一楼3号铺
世代皇茶(地王广场店),奶茶果汁,905,113.798401,22.812069,长安镇长安长青南路303号
茶韵,奶茶果汁,71,113.815706,22.805847,广东省东莞市长安镇霄边甘元八巷18号101室
咖乐士,奶茶果汁,158,113.779915,22.805605,长安新安新农村新福街东五巷2号
獠(万科金街店),奶茶果汁,64,113.800548,22.801338,东莞市长安镇长盛社区长青南路1号长安万科中心5栋112号
一拾一茶(万科三楼店),奶茶果汁,55,113.800676,22.800959,东莞市长安镇长盛社区长青南路1号长安万科广场3楼40号
海岸茶度(长安中心店),奶茶果汁,79,113.803897,22.801774,东莞市长安镇长盛社区长源街15号
Beauty Tea颐茶,奶茶果汁,36,113.805231,22.801816,长安镇长中路117号颐茶
茶萃吧(横岗头店),奶茶果汁,108,113.789386,22.809036,长安镇横岗头新村横新路七巷一号
卡朵拉,奶茶果汁,28,113.809749,22.807423,东莞市长安镇西铭恩中街三巷6号101室
壹茶伴侣,奶茶果汁,95,113.822237,22.808149,广东省东莞市长安镇万达中央公馆-东区
瑶安茶,奶茶果汁,99,113.806889,22.809884,长安镇咸西竹山街五巷1号103
北纬九度,奶茶果汁,17,113.80601,22.802018,长安镇长中路115号钻石广场
royaltea皇茶,奶茶果汁,101,113.819069,22.809605,长安镇霄边大街54号125室
舒芙蕾,奶茶果汁,35,113.798985,22.800562,长安镇长安万科广场一楼3号门121档
95度休闲时光音乐茶吧,奶茶果汁,57,113.825026,22.806218,东莞市长安镇涌头社区龙泉路18号首层2号铺
乐享贡茶,奶茶果汁,42,113.801594,22.799197,长安镇锦江路426号101室
艾莉雅咖啡茶语馆(地王店),奶茶果汁,11,113.798756,22.8124,东莞市长安镇长盛社区长青南路303号长安商业广场一区1115、1116号
粤色茶颜,奶茶果汁,63,113.817917,22.808888,长安镇霄边大街65号103室
招牌芋圆,奶茶果汁,37,113.790741,22.791986,乌沙环东路228号企汇服务中心一层商铺F15号
最后防线奶茶店,奶茶果汁,63,113.817858,22.809703,广东省东莞市长安镇霄边大道223号万和商业城C-01
陈记香酥板栗饼店,奶茶果汁,38,113.818649,22.807748,广东省东莞市长安镇霄边大街52号105室
泰芒了,奶茶果汁,48,113.820194,22.808263,长安镇长安东门中路1号12栋1053室
葱画鲜茶(长安店),奶茶果汁,19,113.790893,22.811105,东莞市长安镇新安社区横增路121号3号铺
大台北,奶茶果汁,45,113.82569,22.806347,东莞市长安镇涌头社区宏业中路3号新豪城购物广场1楼01号商铺
夜听,奶茶果汁,23,113.809452,22.80872,广东省东莞市长安镇长安莲峰路107号110室
呦呦吧,奶茶果汁,23,113.817713,22.808763,广东省东莞市长安镇霄边社区育兴路三巷17号1号铺
莫茶特,奶茶果汁,36,113.804896,22.805527,东莞市长安镇长盛社区长盛东路35号
茶优语,奶茶果汁,23,113.805419,22.801827,广东省东莞市长安镇长中路117号109室
甄果茶,奶茶果汁,19,113.808799,22.807463,长安镇长安莲峰路80号
一盏茶(长盛东路店),奶茶果汁,11,113.804657,22.805837,长安镇长盛东路43号
亲爱的蜂蜜茶,奶茶果汁,35,113.785649,22.775813,东莞市长安镇乌沙兴一路51号108室
乐享贡茶,奶茶果汁,2,113.795879,22.780329,东莞市长安镇锦厦河南工业区聚和广场锦荣路80号乐享贡茶
茶礼季,奶茶果汁,2,113.80738,22.80265,广东省东莞市长安镇长中路107号101室
沐白(锦华店),奶茶果汁,0,113.799332,22.80421,长安锦厦新村锦华街15号3号铺
溢禾烤奶,奶茶果汁,0,113.801316,22.803689,长安镇长青南路103号101室
研茶工作室,奶茶果汁,0,113.804142,22.804216,东莞市长安镇沙埔头中一巷8号102
鲸饮の屋(长安万科店),奶茶果汁,44,113.801113,22.800484,广东省东莞市长安镇长盛社区长安长青南路1号4栋123号
七年钟情为好茶,奶茶果汁,56,113.790504,22.79168,长安镇乌沙环东路228号
爽洋洋奶茶汉堡店(长安霄边店),奶茶果汁,54,113.818016,22.8087714,东莞市长安镇霄边社区霄边大街63号社前苑首层2号商铺
贡茶(万达店),奶茶果汁,32,113.821134,22.808375,长安镇长安东门中路1号11栋1248室
悦洱(长安店),奶茶果汁,38,113.800762,22.804711,东莞市长安镇锦华街五巷6号101室
乌叶(地王广场店),奶茶果汁,25,113.799194,22.812154,广东省东莞市长安镇长盛社区长青南路303号地王广场二区2032号铺
茶π,奶茶果汁,16,113.817461,22.803012,长安镇霄边大街39号101室
禧茶,奶茶果汁,24,113.825126,22.805208,长安镇涌头宏业南路21号
鹿憩奶茶店,奶茶果汁,0,113.800455,22.799913,东莞市长安镇万科广场2栋125号
快乐番薯(长安宵边店),奶茶果汁,469,113.8192315,22.80951798,东莞市长安镇霄边沃尔玛二楼快乐番薯店
四季柠檬(大岭山店),奶茶果汁,21,113.829029,22.906194,东莞市大岭山镇领尚天地5栋商铺1010号
味力果（广科店）,奶茶果汁,346,113.75496,22.969898,东莞市南城区西湖路99号广东科技学院6栋学生公寓首层17号铺
萌茶茶,奶茶果汁,79,113.791001,22.98473,东城街道光明社区光明大路东8号之二
卡乐巴巴,奶茶果汁,41,113.791886,23.026339,东城街道乌石岗工业路3号31栋108室
一隅有茶(卡丽兰店),奶茶果汁,26,113.814347,23.018531,东莞市寮步镇东N路寮步段87号121室（中惠卡丽兰附近）
茶萃吧(东城店),奶茶果汁,37,113.790983,23.025514,东城街道乌石岗商业路1号102室
蜜语茶言,奶茶果汁,0,113.813601,22.98659,广东省东莞市东城街道新园商业街11号110室
大口九烧烤小吃奶茶店,奶茶果汁,519,113.785783,23.034403,新三杞新安街大口九烧烤小吃奶茶店
书亦烧仙草（东莞东城万达店）,奶茶果汁,246,113.780669,23.034722,广东省东莞市东城街道东纵路东城段208号东城万达广场4栋105室
芦蜜欧（主山店）,奶茶果汁,191,113.781314,23.038029,广东省东莞市东城街道主山市场街六巷1号101室
快乐番薯(东城万达店),奶茶果汁,261,113.780397,23.035781,东莞市东城区主山东纵路208号万达广场室内一号门永辉超市旁
niuniu c&m(天宝店),奶茶果汁,228,113.781419,23.043708,东莞市东城街道星城社区芳桂园馨桂苑S6.S7号
快乐番薯(温周路店),奶茶果汁,274,113.822138,23.039356,东城街道温塘社区温周南路29号
火锅茶憩(东莞东城万达店),奶茶果汁,262,113.781293,23.033888,广东省东莞市东城街道东纵路东城段208号东城万达广场1栋3005室
化州糖水奶茶小食店,奶茶果汁,68,113.820971,23.035429,东莞市东城街道温塘温周南路883号
浅浅茶(东城店),奶茶果汁,67,113.798623,23.060402,东城街道环城东路东城段1号1083室
浪漫雪奶茶小吃,奶茶果汁,51,113.794533,23.042079,东城街道主山社区塘边头村塘一街增5号塘边头市场南区路口铺11号
茶驿站,奶茶果汁,150,113.790446,23.060092,东城街道辖下桥鞋业市场绿化路10号
茶萃吧,奶茶果汁,53,113.827176,23.03577,东城区，温塘，温竹路，鸿联市场，万正广场
茶驿站(温塘店),奶茶果汁,109,113.826203,23.035801,东城街道温竹路东城段15号107室
点点冰,奶茶果汁,49,113.788562,23.062138,东城街道银珠街4号109室
盛夏の茶(下桥店),奶茶果汁,18,113.791096,23.058123,东莞市东城下桥银珠路侨苑山庄A座
C酷饮品,奶茶果汁,20,113.82123,23.034543,东城街道温竹路东城段3号4栋109室
想酷饮(温塘店),奶茶果汁,38,113.827053,23.038254,广东省东莞市东城街道温竹二横路28号
呦呦吧,奶茶果汁,12,113.806959,23.057787,东城街道圃园西路45号102室
邦妮Bonnie甜品生活馆,奶茶果汁,9,113.793714,23.039137,东城街道主山大井头振兴路241号
royaltea皇茶,奶茶果汁,0,113.780796,23.036731,主山东纵大道43号天骄百货一楼58-59号
芦蜜欧(新世纪星城店),奶茶果汁,232,113.799882,23.033844,东莞市东城区石井基湖一路121号
HITEA宁茶(银洋路店),奶茶果汁,0,113.809691,23.056596,广东省东莞市东城街道桑园社区银洋路1号综合市场A区第127号铺
茶士多(东城店),奶茶果汁,743,113.785146,23.04851,东城街道新兴街东七巷8号102室
可夫子咖啡,奶茶果汁,19,113.788806,23.052394,东莞市东城区星城社区太和城市花园蔚蓝星湖星慧庭A30(B)商铺
帝一栗（下桥店）,奶茶果汁,23,113.79664,23.060993,东城街道星城社区环城东路400号景天花园23栋150号商铺
半杯约定(温塘店),奶茶果汁,71,113.825911,23.03574,东城街道温竹路东城段15号105室
优の味奶茶咖啡,奶茶果汁,70,113.829316,23.04653,东莞市东城街道温塘广场276路
半糖,奶茶果汁,62,113.761262,23.030221,莞城街道旗峰路162号中侨大厦一楼
印茶,奶茶果汁,0,113.76711,23.0540095,堑头瑞龙路26号101室
猫山王榴莲先生(万达店),奶茶果汁,9,113.78042,23.034048,东莞市东城街道主山东纵路208号万达广场室外步行街1栋50号
世代皇茶(竹园店),奶茶果汁,0,113.827717,23.036299,东城街道温竹路东城段79号101室
世代皇茶(温塘店),奶茶果汁,0,113.820807,23.036079,东城街道温塘温周路89号
DIVINER TEA 趣语(地王店),奶茶果汁,13,113.767322,23.038447,莞城街道东纵路莞城段2号149室
Y御贡茶(桑园店),奶茶果汁,0,113.810491,23.057296,东城街道桑园圃园西路45号万正广场一楼A17号商铺
Blano布兰诺奶茶(星河城店),奶茶果汁,0,113.798873,23.022405,东莞市东城街道石井中心新村4巷29号
西泡泡茶饮沙拉小吃(东城店),奶茶果汁,13,113.782717,23.040894,东城街道金宝路62 号西泡泡
茶微语(东城店),奶茶果汁,0,113.782049,23.03542,东纵路东城段1号1栋111室
Energytea茶稻谷,奶茶果汁,0,113.82662,23.036019,东城街道温竹路东城段15号116室
益禾堂(万达广场店),奶茶果汁,3434,113.780865,23.033617,广东省东莞市东城街道东纵路东城段208号东城万达广场4栋56室
茶茶里(岗贝社区店),奶茶果汁,0,113.759008,23.035604,东城街道岗贝社区东城小学教师楼21-22号铺
悦果时间(莞城万科城店),奶茶果汁,4,113.766238,23.025814,莞城街道旗峰路莞城段200号4单元108室
糖心莉莉,奶茶果汁,3,113.766011,23.025128,莞城街道旗峰路莞城段200号3单元101室
阿一柠檬茶(东城万达店),奶茶果汁,0,113.781744,23.034328,广东省东莞市东城街道东纵路东城段208号东城万达广场4栋108室
最后防线(刘屋店),奶茶果汁,211,113.786598,23.08635,广东省东莞市石碣镇石碣刘屋市场1号107室
茶自然(寿司炸鸡小吃饮品),奶茶果汁,278,113.829025,23.057602,东莞市东城区温塘社区砖窑综合市场030铺
潮恬茶饮(刘屋店),奶茶果汁,24,113.786307,23.086985,东莞市石碣镇刘屋村同德路308号刘屋市场小吃广场5号铺（市场边）
想茶(同富西路店),奶茶果汁,47,113.804361,23.10003,石碣镇同富西路19号101室
喜诺咖啡,奶茶果汁,55,113.809757,23.057766,东城街道桑园圃园西路7号
果茶,奶茶果汁,43,113.814771,23.08633,东城街道榴花路10号108室
茶之缘奶茶(上桥店),奶茶果汁,11,113.791624,23.071932,东莞市东城街道上桥肉菜市场铺位梯间3号铺
茶驿站,奶茶果汁,0,113.81422,23.08504,东莞街道峡口榴花路32号之二
海岸茶度(石碣店),奶茶果汁,1404,113.80382,23.096463,东莞市石碣镇石碣村园吓路14号一楼商铺
御甜奶茶饮品炸小吃,奶茶果汁,574,113.804946,23.106843,广东省东莞市石碣镇石单路129号
寻茶迹(西南店),奶茶果汁,371,113.818755,23.110014,石碣镇石碣庆丰东路68号102室
潮恬茶饮(上一村店),奶茶果汁,117,113.810673,23.095791,东莞市石碣镇石碣村同德西路48号一楼
niuniu c&m(石碣店),奶茶果汁,516,113.816881,23.097385,广东省东莞市石碣镇石碣新风东路26号107室
鹿角巷奶茶,奶茶果汁,147,113.816608,23.100921,广东省东莞市石碣镇城中光明路4号合信广场2号楼212
东御贡茶,奶茶果汁,65,113.803644,23.099514,东莞市石碣镇石碣二村新悦商贸市场中央大道1、2、3、4号档位
果味斯(石碣天和明珠店),奶茶果汁,67,113.80482,23.100315,广东省东莞市石碣镇石碣同富西路15号104室
墨小墨奶茶,奶茶果汁,53,113.822519,23.105697,东莞市石碣镇蟠桃路20号106室
百柠百味(石碣店),奶茶果汁,99,113.81524,23.101844,东莞市石碣镇新城区光明路133号之三号铺
花粉热,奶茶果汁,30,113.812009,23.104677,东莞市石碣镇新城区星光路富盈花园26、27号商铺
小确茶,奶茶果汁,47,113.816068,23.099961,东莞市石碣镇城中光明路4号合信广场2号楼，华夏嘉纳电影院3楼，318室
逅座十二茶,奶茶果汁,10,113.814484,23.100527,石碣镇城中社区龙泉街5号一楼
炸鸡星球(石碣店),奶茶果汁,39,113.816499,23.100895,广东省东莞市石碣镇城中光明路4号合信广场2号楼201室
最后防线(石碣店),奶茶果汁,86,113.814324,23.100946,东莞市石碣镇城中社区东风南路56号一楼
一座一茶(石碣店),奶茶果汁,18,113.804961,23.098437,石碣科技东路5号1173室
快乐茶渡,奶茶果汁,37,113.809703,23.096822,广东省东莞市石碣镇石碣下一村新风中路
TC机遇咖啡,奶茶果汁,21,113.806634,23.099436,东莞市石碣镇新城区石单南路富盈盈翠华庭7栋商铺180号
醉茶,奶茶果汁,110,113.8421,23.10576,广东省东莞市石碣镇晋煌一路22号107室
紫轩蛋糕,奶茶果汁,15,113.790449,23.106228,东莞市石碣镇四甲村庆丰中路511号
小小鲁班茶,奶茶果汁,10,113.805489,23.104962,东莞市石碣镇桔洲石单路166-5号
致幸咖啡(新风东路江景华庭店),奶茶果汁,10,113.816587,23.097467,广东省东莞市石碣镇石碣新风东路26号109室
御喜贡茶(四甲店),奶茶果汁,25,113.789612,23.106307,东莞市石碣镇四甲村华佳购物商场南4号
呀咪休闲驿站,奶茶果汁,27,113.803849,23.096334,东莞市石碣镇石碣村园吓路16号之一
手握披萨,奶茶果汁,20,113.804542,23.098339,东莞市石碣镇石碣科技东路5号1172室
520一杯会告白的茶,奶茶果汁,5,113.815521,23.10021,东莞市石碣镇城中光明路4号合信广场2号楼316室
伯爵TEA(石碣店),奶茶果汁,1,113.815725,23.104555,广东省东莞市石碣镇崇焕东路135号137室
银色星座,奶茶果汁,33,113.816928,23.097374,广东省东莞市石碣镇石碣新风东路26号103室
莉亚鲜茶,奶茶果汁,87,113.793203,23.171728,广州市增城区石滩镇立新东路57号汇商新城4栋首层115号
林小媛,奶茶果汁,129,113.86088,23.184897,石滩镇三江中山路9号
喜辐P鲜果茶(增城万达店),奶茶果汁,1182,113.815854,23.275266,广州市增城区荔城街增城大道69号万达金街113房
麦甜艾斯(敏捷锦绣广场店),奶茶果汁,166,113.811767,23.287281,荔城街府佑路108号1幢191房01号
益禾堂(万达店),奶茶果汁,785,113.815941,23.27513,荔城街增城大道69号1栋120号
老司机的茶(万达店),奶茶果汁,559,113.815277,23.276029,增城大道万达广场金街1栋103号
9.9鲜果茶,奶茶果汁,222,113.823006,23.280917,广州市增城区荔城街洋角街一巷8号首层
阿柠哒(增城万达店),奶茶果汁,137,113.816066,23.275639,荔城街增城大道69号金街一层125号
地铁站港饮（万达店）,奶茶果汁,134,113.815277,23.276029,广州市增城区荔城街增城大道69号1幢2108-万达广场F2-2056地铁站-宝贝王旁
米芝莲(万达广场店),奶茶果汁,80,113.815351,23.276774,荔城街增城大道69号1幢1100号之五
砖心茶(增城万达店),奶茶果汁,203,113.814376,23.276888,荔城街增城大道69号一栋183-185号铺
奈茶NAICHA(敏捷锦绣广场店),奶茶果汁,262,113.810342,23.286686,荔城街府佑路108号1幢184房01号(即敏捷锦绣广场一楼步行街2号门旁)
MOMO茶,奶茶果汁,708,113.829766,23.288324,荔城街园圃路13号101房
红桃兔饮品小吃,奶茶果汁,73,113.815951,23.275716,荔城街增城大道69号1幢181号
鹏敏时光荟美食店,奶茶果汁,12,113.813784,23.276365,广州市增城区荔城街增城大道69号1幢169号首层
五冰室(人人乐店),奶茶果汁,562,113.827454,23.285493,荔城街荔园西路68号首层之一
金糖糖,奶茶果汁,118,113.829713,23.285734,广州市增城区荔城街莲翠街10号首层
世代皇茶(东汇城店),奶茶果汁,59,113.818748,23.282965,广州市增城区荔城街府佑路98号1105号之二大润发正门口对面世代皇茶
酷客小站(挂绿广场店),奶茶果汁,186,113.833243,23.291271,荔城街挂绿路2号挂绿广场商贸城2楼B区中庭栏杆位
以心为茶,奶茶果汁,336,113.832599,23.288061,荔城街莲园路45号之一（首层）
七钟茶(挂绿广场店),奶茶果汁,315,113.832648,23.289767,荔城街挂绿路6号地王广场10026铺
简谷茶(万达店),奶茶果汁,29,113.815951,23.275716,荔城街增城大道69号1幢142-143号
友缘,奶茶果汁,78,113.83221,23.28832,荔城街莲园路43号之六1栋108房
卡玛顿(新天美地店),奶茶果汁,43,113.822772,23.300417,富安路73号
森茶饮,奶茶果汁,48,113.827077,23.30108,荔城街菜园中路38号
Hitea茶室(荔兴路店),奶茶果汁,50,113.826537,23.28756,荔城街荔兴路45号(首层)
四季柠檬(荔园西路店),奶茶果汁,37,113.826463,23.286091,荔城街荔园西路66号首层
买杯S饮(挂绿店),奶茶果汁,46,113.835189,23.28876,荔城街中山路88号
马后泡手作好茶,奶茶果汁,37,113.832707,23.288526,荔城街莲园路住宅区第一幢127号
缇贝斯,奶茶果汁,19,113.827599,23.295956,广州市增城区荔城街富国路20号首层
遇见么么茶（时代广场店）,奶茶果汁,8,113.833335,23.29026,广东省广州市增城区荔城街道时代广场(挂绿路)6号之一首层103号
清谷鲜茶,奶茶果汁,18,113.821624,23.283306,荔城街观园东路南一巷6号首层
UF-YUMMY吖咪(增城店),奶茶果汁,15,113.826983,23.289286,广州市增城区荔城街荔兴路21号首层
肥熊茶食,奶茶果汁,553,113.826881,23.285646,荔园西路51号之五首层
小兮烧仙草(敏捷广场店),奶茶果汁,0,113.812359,23.286946,荔城街府佑路108号1幢103房01号
咕猫柠(敏捷锦绣广场店),奶茶果汁,0,113.811767,23.287281,荔城街府佑路108号1幢173房
21st FOUREVER(伯乐广场店),奶茶果汁,81,113.823122,23.300763,广州市增城区荔城街新园路33号101之1
G港茶饮,奶茶果汁,141,113.827119,23.29995,荔城街菜园中路36号首层
益禾堂(合汇广场店),奶茶果汁,0,113.82007,23.282494,荔城街合汇广场钻石街37号S2-首层118号
绿之岛,奶茶果汁,38,113.846381,23.283291,增江街东桥东路52号首层1号铺位
蜜语茶言(莲园路店),奶茶果汁,109,113.83337,23.287967,荔城街莲园路59号之六首层
缤果鲜茶BingoTea(富鹏店),奶茶果汁,1,113.826784,23.297066,广州市增城区荔城街菜园中路9号101房
壹点鲜茶(万达店),奶茶果汁,594,113.816076,23.2751,荔城街增城大道69号1幢118号
艾斯,奶茶果汁,0,113.832114,23.290878,挂绿路东五巷一栋103号
相约奶茶,奶茶果汁,2,113.806064,23.296337,荔城街荔城大道302号自编B01
贪吃熊,奶茶果汁,44,113.810342,23.286686,荔城街府佑路108号2幢114号（即红格教育后面）
万小茶(增城店),奶茶果汁,3,113.815991,23.276163,广东省广州市增城区荔城街增城大道69号万达广场娱乐楼4层
康格鲁(万达广场店),奶茶果汁,0,113.815951,23.275716,荔城街增城大道69号负一层148、149房
Hi果果(锦绣广场店),奶茶果汁,0,113.811392,23.286801,荔城街府佑路108号1幢敏捷广场4楼418号
纵横,奶茶果汁,0,113.835845,23.292301,广州市增城区荔城街新桥路17号一幢一楼自编101商铺
浅浅茶EASY TEA,奶茶果汁,395,113.832757,23.289692,荔城街挂绿路6号地王广场美食街
芒果先生鲜果饮品,奶茶果汁,44,113.835944,23.289461,广州市增城荔城街江陵里东一巷3号首层(旧市场小吃巷中间)
硕先生,奶茶果汁,2,113.833913,23.287866,荔城街挂绿路西三巷一幢101房
贡茶(固戍一路店),奶茶果汁,1316,113.844101,22.590375,西乡街道固戍社区固戍一路889固戍花园118号
金小太(固戍店),奶茶果汁,1732,113.848766,22.603027,深圳市宝安区西乡街道万象新天香格丽湾园2栋06号商铺
贡茶(固戍店）,奶茶果汁,418,113.846338,22.597753,西乡街道固戍下围园新村茶树工业区B栋前面平房102（下围园新村一巷7号对面）
玩味茶饮（固戍店）,奶茶果汁,179,113.853294,22.603481,深圳市宝安区西乡街道固戍二路北侧华达大厦一楼A19
