店铺名字,类别,月销售,经度,纬度,地址
悦茶廊精品(石岩店),奶茶果汁,352,113.93219,22.677674,深圳石宝安区石岩街道浪心社区宝石南路131号
小司茶道(石岩店),奶茶果汁,0,113.917351,22.662175,深圳市宝安区石岩街道浪心社区石岩村第一工业区第五栋121
爽洋洋奶茶汉堡手抓饼(玉律社区店),奶茶果汁,166,113.89814,22.717916,深圳市光明区玉塘街道玉律村三区2号
茶萃吧,奶茶果汁,232,113.913146,22.719099,光明新区玉塘街道长圳社区佳联华购物广场1栋40号
茶萃吧(长圳步行街店),奶茶果汁,44,113.920165,22.718527,光明新区公明镇长圳社区长圳路长圳步行街1号楼7号铺
茶e思(玉律店),奶茶果汁,54,113.900869,22.717688,公明街道玉律社区玉泉东路20-1南海百货W024号铺
馨茶,奶茶果汁,48,113.899527,22.731584,深圳市光明新区公明街道田寮社区田富路26号
星期8奶茶小吃,奶茶果汁,11,113.89766,22.718547,广东省深圳市宝安区玉律三区17号
666Fruit Tea水果茶,奶茶果汁,24,113.900279,22.717933,玉律社区玉泉东路22-2号
方圆道,奶茶果汁,44,113.894173,22.73075,玉塘街道田寮村等十工业区六栋二楼
西子巷茶,奶茶果汁,0,113.894866,22.729206,深圳市光明区玉塘街道田寮社区宝山路15号铭锋达工业园101
御茶(龙湾店),奶茶果汁,8,113.904841,22.727746,田寮村龙湾路33号
西麦奶茶汉堡小吃店(塘尾店),奶茶果汁,2369,113.905655,22.7528,广东省深圳市宝安区公明街道将塘路130号
茶乐嘟-奶茶-小吃(公明店),奶茶果汁,1114,113.909025,22.762959,深圳市光明区马田街道新庄社区同富工业区c栋鹏辉幼儿园正对面巷子第一个门面
贡茶,奶茶果汁,556,113.923992,22.735934,深圳市光明新区凤凰街道塘尾社区同惠路与同业路交汇处星悦居第9号铺
卡洛熊,奶茶果汁,291,113.929701,22.737545,凤凰街道塘家社区光谷苑4栋10-2
西麦奶茶汉堡小吃(塘家店),奶茶果汁,478,113.937733,22.730783,凤凰街道塘家社区塘家大道19号
冰公仔(将石店),奶茶果汁,28,113.900572,22.753547,将石社区将石路98号
爽洋洋奶茶汉堡,奶茶果汁,6,113.916976,22.754507,光明新区公明街道东坑社区东坑路20―1号
7点茶饮(红木小镇店),奶茶果汁,192,113.910236,22.783592,公明街道红木小镇岭南街155-156号7点茶饮
大口九(创业店),奶茶果汁,30,113.90895,22.767496,新围商业街16栋大口九
邂逅,奶茶果汁,44,113.94784,22.789611,新湖街道圳美社区旧围路57号
王者茶语奶茶店,奶茶果汁,15,113.904562,22.755302,广东省深圳市光明新区公明街道塘尾社区塘前路113号明知花苑A栋1-1商铺
汤尼斯(腾辉店),奶茶果汁,4,113.907296,22.754059,光明新区公明街道塘尾社区塘尾油站C栋二楼
星意,奶茶果汁,17,113.943069,22.760367,光明新区光明街道新地中央2号楼二单元2层18号19号
101の茶,奶茶果汁,113,113.946665,22.758422,光明街道翠湖社区河心北路132号清怡花园商铺
299意式咖啡(公明店),奶茶果汁,61,113.910217,22.782577,深圳市光明区公明街道红满庭红木文化小镇锦绣街158-160号
新茶时代（新围店）,奶茶果汁,10,113.908095,22.764335,深圳市光明新区公明街道将石社区新围旧村五排1栋
香夏茶,奶茶果汁,1,113.914441,22.764256,深圳市光明新区公明街道将石社区新围第四工业区一栋101
品茶,奶茶果汁,1,113.941269,22.752808,光明新区光明街道公园路和润家园1栋三号铺
80粢家,奶茶果汁,1,113.908958,22.774505,广东省深圳市宝安区公明街道后底山二路翰林幼儿园(南庄田园路)
甜思木,奶茶果汁,0,113.925823,22.756918,高新路11号研祥智谷公寓大楼B001
每天遇见果茶(光明店),奶茶果汁,11,113.947856,22.758512,深圳市光明新区光明街道碧眼社区碧眼新村1区1号101
茶思语,奶茶果汁,1,113.908027,22.754896,深圳市光明新区公明街道塘尾社区东隆路惠丰广场A04号
碰茶（峰荟时代店）,奶茶果汁,0,113.90255,22.764137,深圳市光明区马田街道石家社区峰荟时代科技中心A座112
太清・甜品・凉茶(上域店),奶茶果汁,232,113.9076335,22.78083581,深圳市光明新区公明街道处宏发上域人人乐超市南门进入10米
诺诺甜甜屋,奶茶果汁,235,113.901374,22.796025,光明新区公明街道西甜社区莲塘商业城1030号
下午三点・水果茶(公明天虹店),奶茶果汁,47,113.89302,22.782257,广东省深圳市宝安区公明街道振明路122号天虹商场(公明店)
爽洋洋奶茶汉堡,奶茶果汁,53,113.899605,22.791788,深圳市光明新区公明街道上村社区下南第三工业区友谊百货直行30米
西田新茶人,奶茶果汁,50,113.900271,22.803433,深圳市光明新区公明街道西田社区第二工业区商业楼第5栋1楼A区5号
世代皇茶（西田店）,奶茶果汁,36,113.900627,22.803035,光明新区公明街道西田社区金三角75-1号
全记柠檬茶(旗舰店),奶茶果汁,18,113.891626,22.788612,深圳市光明新区公明街道上村社区上南水贝路30号
蔓时光茶饮,奶茶果汁,17,113.925889,22.781087,深圳市光明新区公明街道楼村绘猫路79号
茶・咖啡炸鸡汉堡(水平村店),奶茶果汁,167,113.917571,22.878267,大朗镇水平村松水路346号
爽洋洋奶茶小吃汉堡,奶茶果汁,81,113.910399,22.894877,大朗镇松木山村松山路60号2号铺
贝克汉堡,奶茶果汁,47,113.917072,22.874892,广东省东莞市大朗镇水平红旗路40号101室
新奇香柠（水平村店）,奶茶果汁,94,113.917966,22.876442,大朗镇水平村商贸城第壹层A排22-23号商铺
ComeCoffee(大朗店),奶茶果汁,148,113.935596,22.928095,东莞市大朗镇圣堂社区圣堂花园23-24号商铺
爽洋洋奶茶汉堡(黄草朗店),奶茶果汁,69,113.914283,22.916104,东莞市大朗镇黄草朗社区便民街18号A1铺
85极致咖啡(长富西路店),奶茶果汁,164,113.914907,22.934104,广东省东莞市大朗镇求富路长富西路268号126室
想酷饮炸鸡汉堡奶茶,奶茶果汁,100,113.911216,22.941626,东莞市大朗镇黎贝岭村富新小区99号
royaltea皇茶,奶茶果汁,82,113.921008,22.930338,大朗镇长富社区松佛路229号碧水天源枫景台首层117号铺
奉茶(长富西路店),奶茶果汁,49,113.914696,22.934427,大朗镇求富西路268号140室
EASYTEA浅浅茶,奶茶果汁,80,113.938945,22.935504,东莞市大朗镇圣堂社区大朗市场一楼第02号右梯间
小时光奶茶店,奶茶果汁,106,113.933777,22.938729,广东省东莞市大朗镇长育路50号101房
茶饮柠檬,奶茶果汁,36,113.929517,22.933164,大朗镇长盛广场千福粥点对面
茶极限（大朗店）,奶茶果汁,52,113.938209,22.935318,大朗镇圣堂社区美景中路216号大朗市场停车场5号铺
爽洋洋奶茶汉堡（大朗店）,奶茶果汁,37,113.947929,22.933519,东莞市大朗镇蔡边村政通路228号1号铺
520一杯会告白的茶,奶茶果汁,54,113.928012,22.9294805,广东省东莞市大朗镇大朗美景中路586号二栋103室
茶声茶言,奶茶果汁,0,113.929612,22.933752,东莞市大朗镇长盛南路37号120号
茶印,奶茶果汁,16,113.932573,22.929271,大朗镇长塘长和街79号
茶萃吧(黄草朗店),奶茶果汁,27,113.915221,22.917116,大朗镇黄草朗社区信江商业广场第一号铺
忆心茶,奶茶果汁,3,113.937028,22.93468,广东省东莞市大朗镇大朗美景中路288号109室
猫CC,奶茶果汁,12,113.91655,22.942361,广东省东莞市大朗镇聚新三路23号109室
乐喜悦饮食店,奶茶果汁,69,113.90567,22.97826,广东省东莞市寮步镇丰华路38号101室
语之茶饮品美食(大朗店),奶茶果汁,238,113.940867,22.945615,大朗镇圣堂社区红荔商业城美食街木屋3号
798奶茶鲜榨果汁,奶茶果汁,652,113.910614,22.950752,东莞市大朗镇黎贝岭村综合市场正门口(康隆百货门口)798饮品店
驿茶(九龙百货店),奶茶果汁,222,113.908981,22.954983,大朗镇黎贝岭村新围仔九龙百货
仙芋道,奶茶果汁,348,113.938403,22.935167,东莞市大朗镇圣堂社区美景中路216号大朗市场停车场3号铺
青柠度小吃手抓饼果汁车仔面,奶茶果汁,90,113.907557,22.976026,寮步镇凫山村翠花街润好市场服务管理有限公司广场E019商铺
丸子茶屋(远大广场店),奶茶果汁,148,113.948974,22.9550256,东莞市大朗镇大朗社区郎东路1号远大城市广场地下一楼
柠檬茶会跳舞,奶茶果汁,53,113.9460498,22.96062717,大朗镇大井头顺兴六路23号
蜜客酷饮+正宗长沙臭豆腐,奶茶果汁,402,113.907205,22.975991,广东省东莞市寮步镇凫山村翠华街12号大润发时代广场1号铺
CoCo都可(大朗长盛店),奶茶果汁,917,113.929402,22.931137,东莞市大朗镇长塘社区美景中路新世纪长盛广场3H01号外广场1102号铺
滨果茶饮,奶茶果汁,83,113.914507,22.941469,广东省东莞市大朗镇聚新三路66号115室
零度2奶茶店(松柏朗店),奶茶果汁,59,113.910887,22.934563,大朗镇新佛路新富街2号118室
银色星座,奶茶果汁,61,113.905121,22.979734,广东省东莞市寮步镇凫山兴山路67号
茶丸家(大朗店),奶茶果汁,55,113.942409,22.942936,广东省东莞市大朗镇金丽路36号
鹤响茶,奶茶果汁,44,113.918276,22.957616,广东省东莞市大朗镇大朗富康路233号毛织贸易中心东门门口102室(中熙松湖国际对面)
C引C饮港式奶茶屋,奶茶果汁,36,113.925646,22.968114,大朗镇高英村高英路213号5铺
胡桃夹子御茶,奶茶果汁,49,113.948991,22.954658,东莞市大朗镇大朗社区朗东路1号远大城市广场2幢商铺126
艾尚奶茶,奶茶果汁,50,113.906977,22.949224,大朗镇大朗富丽西路242号102室
皇茶,奶茶果汁,40,113.948121,22.955817,大朗镇大朗社区O东路1号远大城市广场2栋商铺137
想酷饮,奶茶果汁,20,113.940248,22.953317,东莞市大朗镇大井头社区永顺路70号4号商铺
吾家有茶,奶茶果汁,7,113.932718,22.944682,东莞市大朗镇大朗社区富华中路181号五福购物中心（万荟时代）项目北广场美食街商铺小木屋8号档
禾美饮品,奶茶果汁,43,113.932572,22.935435,东莞市大朗镇长塘长育路186号102室
鲜榨果汁,奶茶果汁,31,113.927254,22.982124,东莞市东坑镇初坑村永生路华晟市场E11号
仟味茶(大朗店),奶茶果汁,33,113.9325956,22.94454792,东莞市大朗镇大朗社区长富东路步行街21号
Minkai果汁,奶茶果汁,23,113.940781,22.953984,东莞市大朗镇大井头社区永顺路43号一楼2号铺
趣香园（金美店）,奶茶果汁,8,113.980948,22.967673,常平镇金美村金美综合大楼广场A1号
鲜果CC奶茶店(大朗店),奶茶果汁,90,113.933425,22.944988,广东省东莞市大朗镇大朗富华中路181号1031室
岛滋古法黑糖,奶茶果汁,285,113.933514,22.944561,广东省东莞市大朗镇大朗富华中路181号133室
鲜作茶自然,奶茶果汁,131,113.929742,22.980078,广东省东莞市东坑镇永生路31号101室
小茶日记,奶茶果汁,0,113.915065,22.962417,广东省东莞市大朗镇大朗富康路273号3栋102室之一
约柠檬,奶茶果汁,0,113.904931,22.977644,寮步镇丰华路3号二栋115室
LicoPark小公园甘草水果,奶茶果汁,2,113.893429,22.958071,广东省东莞市松山湖管委会松山湖光大・We谷B1栋102室
六月雪糖水店,奶茶果汁,135,113.924723,22.979856,东莞市东坑镇初坑村东坑大道南279号
西关牛杂(皇家公馆店),奶茶果汁,114,113.935822,22.997723,东莞市东坑镇黄屋村皇家公馆10-12栋179B铺
鲜桔柠檬,奶茶果汁,10,113.92002,23.018745,广东省东莞市东坑镇角社村东兴西路239号C
快乐番薯(寮步西溪市场店),奶茶果汁,47,113.90492,22.99381,东莞市寮步西溪综合市场C2商铺
素岛泰茶,奶茶果汁,80,113.933249,22.998854,东坑镇东皇步行街1号御景华府1号楼114室东旭0769对面
贡茶,奶茶果汁,0,113.941347,22.996756,东莞市东坑镇凤大村东兴路161号一楼A
致爱丽丝奶茶小吃,奶茶果汁,40,113.930618,23.033367,石涌村西城三区352号
追茶到底,奶茶果汁,52,113.914611,23.04953,广东省东莞市茶山镇超横路超朗综合市场
安莉私房(东兴西路西店),奶茶果汁,14,113.926044,23.008594,广东省东莞市东坑镇角社东兴西路西一巷16号101室
言~^,奶茶果汁,515,113.94686,23.07982,石排镇润升商业中心停车场正对面
皇茶HappyTaste(润升店),奶茶果汁,37,113.946021,23.080147,东莞市石排镇石排村石排大道中润升商业中心二楼E009号
百S炸鸡-汉堡-奶茶,奶茶果汁,114,113.9287,23.15839,石湾镇铁场村梅花大道
红人馆,奶茶果汁,38,113.933113,23.157504,博罗县石湾镇铁场物流中心骑楼街B区4号
泰芒了(石湾大有村店),奶茶果汁,129,113.908177,23.180664,石湾镇大有村万泰百货一楼
贡茶(科兴店),奶茶果汁,1546,113.942735,22.541522,粤海街道科兴路9号1楼
贡茶(南山直营店),奶茶果汁,1733,113.95175,22.57625,深圳市南山区新光路新源工业区七栋101-6
1828王老吉（深圳科学园店）,奶茶果汁,72,113.944705,22.548926,深圳市南山区粤海街道科技园社区科苑路15号科兴科学园B栋B-G-08
600里奶茶・手抓饼(西丽店),奶茶果汁,1880,113.953929,22.57448,西丽街道西丽居委综合楼1楼10号铺
星叹・果汁冰(科技园店),奶茶果汁,1061,113.948511,22.545265,粤海街道深南西科慧路1号沛鸿产业园A1栋1层106B号
云顶新茶(科兴直营店),奶茶果汁,273,113.943986,22.548736,深圳市南山区粤海街道科技园中区科苑路15号科兴科学园C层1楼外1号铺
蔻茶(西丽店),奶茶果汁,525,113.941807,22.574183,西丽街道西丽留仙洞总部基地打石二路南侧云城万科里C绿廊B1-007，万科里西里西贝莜面村旁边电梯下去。
厝内小眷村（深圳白石洲店）,奶茶果汁,1876,113.969243,22.540652,深圳市南山区沙河街道沙河街社区下白石二坊3号101
琉璃鲸(大冲新城花园店),奶茶果汁,150,113.951446,22.541478,深圳市南山区粤海街道大冲社区大冲新城花园2栋2D座商场2楼408商铺
廿四漂流茶(科技园店),奶茶果汁,405,113.942455,22.540529,深圳市南山区粤海街道科技园社区科兴路科技文化广场1-02c
台盖（益田假日店）,奶茶果汁,716,113.975425,22.537246,深圳市南山区沙河街道益田假日广场B2-MT0-MT1号商铺
大卡司(科技园店),奶茶果汁,86,113.935946,22.541345,深圳市南山区粤海街道科技中一路6号帝景园首层商铺202
1点点（科兴科学园店）,奶茶果汁,3341,113.943552,22.548179,深圳市南山区科兴科学园A－G31
一芳台湾水果茶(大冲都市花园店),奶茶果汁,178,113.953531,22.541358,深圳市南山区粤海街道铜鼓路大冲都市花园商业中心一楼010商铺
贡茶(高新园店),奶茶果汁,125,113.948152,22.545351,深圳市南山区粤海街道科慧路1号沛鸿电子大厦1楼108
益禾堂(白石洲店),奶茶果汁,947,113.967054,22.538827,沙河街道白石洲东社区石洲中路南博耐家具广场东面商铺107
CoCo都可(白石洲店),奶茶果汁,812,113.966989,22.536491,广东省深圳市南山区石洲中路152号
Yomi+优米加(大冲店),奶茶果汁,209,113.952129,22.541058,深圳市南山区粤海街道深南大道9678号大冲商务中心1栋B座（二号楼）第一层B号
TAITEA呔茶(科技园北店),奶茶果汁,109,113.953869,22.558421,朗山路松坪山群芳街62号
813芭依珊 BAESAN（高北十六店）,奶茶果汁,69,113.9431409,22.55479393,广东省深圳市南山区西丽街道科技园北区高新北六路高北十六创意园L-16A号
蜜雪冰城・冰淇淋与茶(平山社区店),奶茶果汁,339,113.966292,22.583245,深圳市南山区桃源街道平山社区丽山路2号平山村67号102
太清|皇牌龟苓膏(深大店),奶茶果汁,521,113.931641,22.52556,深圳市南山区粤海街道学府东路桂庙宿舍楼一楼4-21-1号商铺
锦茶(欢乐谷店),奶茶果汁,70,113.977874,22.537798,深圳市南山区沙河街道侨城西街美加广场31-2
火锅.茶憩（深圳益田假日店）,奶茶果汁,969,113.9751,22.53742,深圳市南山区沙河街道益田假日广场L3-3B号商铺
花羡沐岚冷饮店,奶茶果汁,45,113.950757,22.542122,深圳市南山区粤海街道大冲社区新城花园038-1商铺（2栋2E对面，民心大药房旁）
榴芒一族(杯装甜品万利达大厦店),奶茶果汁,209,113.93364,22.540866,深圳市南山区粤海街道麻岭社区深南大道9992号万利达科技大厦101
Koi（深圳益田假日广场店）,奶茶果汁,252,113.974316,22.537372,广东省深圳市南山区沙河街道益田假日广场B2层M32铺
吾家有甜・奶茶・甜品・蛋糕(世界之窗店),奶茶果汁,64,113.968719,22.547623,白石洲沙河街新塘村二坊12
丧茶,奶茶果汁,118,113.951381,22.541654,深圳市南山区粤海街道大冲社区大冲新城花园b馆2楼284号
面包和茶(科技园店),奶茶果汁,31,113.943179,22.540927,粤海街道科技园社区科兴路10号汇景豪苑301（L1-31）
爽爽甜品（光前店）,奶茶果汁,22,113.9630935,22.5637699,深圳市南山区桃源街道光前村东区67栋一楼
明记甜品,奶茶果汁,39,113.970345,22.541828,深圳市南山区沙河街道白石洲天河路131号
清兮の茶,奶茶果汁,166,113.916252,22.524979,大板桥商业楼41-4
Tinyjoy小悦(科技园文化广场店),奶茶果汁,39,113.943179,22.540927,粤海街道科兴路10号汇景豪苑301（1-32C）
royaltea皇茶(京基店),奶茶果汁,42,113.969951,22.532196,深圳市南山区深圳湾二路与白石路交汇处御景东方花园裙楼112-115(京基百纳广场红树街39号新宜网咖)
仙草频道(南山大道形象店),奶茶果汁,265,113.92458,22.527045,深圳市南山区南山街道康乐大厦一楼A26号铺
黄志强凉茶,奶茶果汁,71,113.960566,22.570226,广东省深圳市南山区桃源街道珠光路珠光花半里
Bakerz180烘焙达人（世界之窗店）,奶茶果汁,93,113.97336,22.536733,深圳市南山区沙河街道地铁一号线世界之窗站CH通道物业区H01-02号铺
派奇屋・水果茶・奶茶(益田假日店),奶茶果汁,61,113.974363,22.537612,深圳市南山区沙河街道益田假日广场L3-8中影益田假日影城大堂上夹层楼梯左侧位派奇屋店（益田店）
谷芋(西丽店),奶茶果汁,124,113.955227,22.579617,深圳市南山区西丽街道丽城社区沙河西路1363号众冠西郡园201（女人世界二楼）
新港人港式奶茶,奶茶果汁,29,113.951395,22.558145,深圳市南山区西丽街道松坪山肉菜市场7－17铺
恋暖初茶深圳益田假日广场店,奶茶果汁,76,113.975095,22.537422,深圳市南山区深南大道9028号益田假日广场B2-M37-M38
地铁站饮品(沙河店),奶茶果汁,73,113.968605,22.546741,深圳市南山区沙河街道沙河工业区大润华超市左侧（8号酒店楼下）
颐茶,奶茶果汁,24,113.95118,22.541768,深圳市南山区粤海街道大冲社区大冲新城花园2-280
徐其修凉茶,奶茶果汁,41,113.968365,22.532359,深圳市南山区沙河街道白石洲村西二坊87号102
4S cafe,奶茶果汁,34,113.931222,22.548877,南头街道马家龙社区大新路88号马家龙63-64栋101
黄志强凉茶（南新路店）,奶茶果汁,295,113.919147,22.525565,深圳市南山区南山街道南新路2033号(丁头村牌坊旁边)俊龙药行凉茶店
颐茶(深大店),奶茶果汁,57,113.932944,22.525456,粤海街道粤桂社区桂庙新村华城百货二楼3号商铺
哈茶世家（前海店）,奶茶果汁,46,113.912723,22.529543,深圳市南山区学府路与前海路交汇处绿海名都一、二层商场101B
椰香清补凉,奶茶果汁,45,113.92483,22.544701,义学街四坊9-4号铺
ORIGINALFRESH原鲜(深圳湾万象城店),奶茶果汁,33,113.946768,22.516049,深圳市南山区粤海街道海珠社区科苑南路深圳湾万象汇负一层B171
8090鲜萃茶,奶茶果汁,21,113.950562,22.557356,西丽街道松坪山朗松路10-18
清茶坊・手抓饼・水果茶(大新店),奶茶果汁,22,113.915379,22.530417,深圳市南山区南头街道大新新村蚝业文化街103号铺
乌所味(南山店),奶茶果汁,10,113.919119,22.524295,深圳市南山区南山街道向南西街12号101
SU深职店,奶茶果汁,40,113.948784,22.585212,深圳市南山区西丽镇旺棠富盛大楼19号SU店铺(3c酒吧旁边)
圣爱米伦咖啡屋,奶茶果汁,3,113.965975,22.527692,沙河街道白石二路中信红树湾会所东侧
新奇饮品xinqi,奶茶果汁,8,113.924711,22.544485,深圳市南山区南头街道义学街4坊8号101
小确茶(白石洲店),奶茶果汁,496,113.970722,22.540818,沙河街道下白石三坊50号101
恋暖初茶(万象天地店),奶茶果汁,123,113.954184,22.541476,深圳市南山区粤海街道深南大道与沙河西路交汇处华润万象天地B107号商铺??
驹小白好好喝吖(科技园店),奶茶果汁,113,113.943759,22.543954,深圳市南山区粤海街道科技园社区科智西路1号科苑西23栋101
Bakerz180烘焙达人(益田假日广场店),奶茶果汁,157,113.974795,22.53778,深圳市南山区深南大道9028号益田假日广场B2层19号铺
黑龙茶(科技园店),奶茶果汁,53,113.9341678,22.54261147,深圳市南山区粤海街道科技园高新中4路汇园雅居13号
IM茶(科技园店),奶茶果汁,59,113.951408,22.541645,深圳市南山区粤海街道大冲新城花园2栋2C座一楼商场内IM茶
爹O的奶茶(科技园豪方花园店),奶茶果汁,95,113.932977,22.542732,广东省深圳市南山区新高中四路88号(豪方花园商铺)
我是酸奶君(科兴科学园店),奶茶果汁,66,113.943549,22.548181,深圳市南山区粤海街道科苑路15号科兴科学园A栋G层02号商铺
Vmax活性鲜榨原汁(科技园店),奶茶果汁,17,113.942665,22.549044,广东省深圳市南山区粤海街道科兴科学园A栋G层07号铺位
AURA,奶茶果汁,15,113.926752,22.549101,深圳市南山区南头街道马家龙社区大新路188号嘉隆公寓大新路182号107-108
CoCo都可(科兴科学园店),奶茶果汁,1229,113.94336,22.54898,广东省深圳市南山区科苑北路15号科兴科学园A栋G层23a号铺
白露与茶(科技园店),奶茶果汁,409,113.948258,22.54552,深圳市南山区粤海街道科慧路1号沛鸿大厦二楼小样青年社区G06白露与茶
鹿角巷奶茶(虚拟大学园店),奶茶果汁,363,113.944488,22.534651,高新南七道20号虚拟大学园R2-A座7层758
贡茶(世界之窗店),奶茶果汁,1166,113.970436,22.540601,深圳市南山区沙河街道下白石三坊51号104店
鹿角巷(金地公寓店),奶茶果汁,76,113.950836,22.527636,粤海街道金地威新公寓102商铺
CoCo都可(中科大厦店),奶茶果汁,442,113.952492,22.538388,深圳市南山区粤海街道中科大厦孵化大楼一楼大厅西侧
小茶犸&酸奶盖&甜品&咖啡(科技园奔驰店),奶茶果汁,141,113.946765,22.544564,迅美科技广场2号楼奔驰大厅
CoCo都可(生态园店),奶茶果汁,146,113.952696,22.530438,深圳市南山区粤海街道高新南九道10号深圳湾科技生态园三区10栋裙楼01层52号
小吃小喝,奶茶果汁,26,113.936789,22.524771,深圳市南山区软件产业基地第2栋裙楼01层07、08号商铺
C杯手工烘焙,奶茶果汁,394,113.934015,22.526855,广东省深圳市南山区粤海街道桂庙新村西部创业园2楼 堕落小龙虾隔壁
美作烘焙,奶茶果汁,39,113.943288,22.549362,深圳市南山区粤海街道科苑路15号科兴科学园A栋113A铺
普克茶吧,奶茶果汁,1,113.941717,22.527875,深圳市南山区粤海街道高新南9道45号三航科技大厦14C室
VolgoCaffe(科兴店),奶茶果汁,46,113.944687,22.546276,粤海街道科技园社区科苑路11号金融科技大厦1楼A座大堂
LOWCAL轻饮休闲吧(科技园店),奶茶果汁,41,113.952678,22.535252,粤海街道科技南八路12号L101号商铺
台盖(科技生态园店),奶茶果汁,986,113.953211,22.528908,深圳市南山区深圳湾科技生态园一区5栋B座25-28号
YO!Tea有茶(科兴科学园店),奶茶果汁,748,113.943549,22.548181,深圳市南山区粤海街道科苑路科兴科学园BG-13号铺
茶米唐鲜果奶茶(创维店),奶茶果汁,366,113.953132,22.536978,高新南四道18创维半导体设计大厦裙楼负一层荟食广场102F1、102F2单元
同心记香港小吃店,奶茶果汁,59,113.944627,22.548365,粤海街道科技园中区科苑路15号科兴科学园B栋G层16G号商铺
联茶,奶茶果汁,210,113.951104,22.541747,深圳市南山区粤海街道大冲社区大冲新城花园1-243 2栋2C一楼商场里面一楼243号铺联茶
o食Foodless,奶茶果汁,2830,113.934069,22.527067,粤海街道桂庙新村39栋3号
TheWhaLeTea奶茶(西丽店),奶茶果汁,134,113.954644,22.578118,深圳市南山区西丽街道丽城社区沙河西路3252号西丽地铁站c出口直行100米琉璃鲸奶茶店
鹿角巷TheAlley(世界之窗店),奶茶果汁,116,113.972206,22.538841,沙河街道深南大道沙河世纪假日广场裙楼负19号
卡乐巴巴・奶茶果汁,奶茶果汁,220,113.952617,22.530753,粤海街道高新区社区南环路28号深圳湾科技生态园8栋139（9栋A座喜市多正对面）
贡茶(益田假日店),奶茶果汁,35,113.972342,22.538535,广东省深圳市南山区沙河街道深南大道9091号沙河世纪假日广场C通道世界之窗贡茶
e杯茶奶茶小吃(西丽店),奶茶果汁,114,113.949885,22.586437,西丽街道新围旺棠工业区14栋榆峰公寓104
茶班生,奶茶果汁,6,113.932975,22.526085,粤海街道桂庙新村学府城购物街（35-1）1楼10号
野茶(科技生态园店）,奶茶果汁,1,113.952696,22.530438,粤海街道南环路28号深圳湾科技生态园8栋8-01-019  戴尔电脑体验店内
E杯好茶EECUP(储能店),奶茶果汁,1,113.944838,22.537842,粤海街道科苑南路3099号中国储能大厦E广场6号商铺
